{
  "schema_version": 1,
  "catalog": {
    "title": "马剃天爱星制品图鉴",
    "scope": "《败犬女主太多了！》中明确包含马剃天爱星的官方实体制品",
    "updated_at": "2026-10-01",
    "status": "expanded_verified_catalog"
  },
  "character": {
    "id": "basori-tiara",
    "name_ja": "馬剃天愛星",
    "name_zh": "马剃天爱星",
    "name_en": "Basori Tiara",
    "aliases": [
      "馬剃 天愛星",
      "天愛星",
      "Basori Tiara"
    ]
  },
  "items": [
    {
      "id": "gagaga-J20260034",
      "name_ja": "『負けヒロインが多すぎる！』9巻 書影タペストリー",
      "name_zh": "小说第9卷封面挂毯",
      "category": "tapestry",
      "campaign": "小说第9卷",
      "campaign_year": 2026,
      "manufacturer": "GAGAGA SHOP ONLINE",
      "variant": "第9卷封面",
      "sale_format": {
        "type": "single",
        "total_variants": null
      },
      "spec": {
        "size": null,
        "material": null
      },
      "release_date": null,
      "list_price_yen": 3300,
      "official_status": "official",
      "verification": "confirmed_text",
      "images": [
        {
          "path": "images/items/gagaga-J20260034.jpg",
          "role": "product",
          "source_url": "https://lifetunes-mall.jp/img/3030/goods/S/J20260034-01.jpg",
          "thumbnail_path": "images/thumbs/gagaga-J20260034.webp"
        }
      ],
      "sales": [
        {
          "seller": "GAGAGA SHOP ONLINE",
          "phase": "general_sale",
          "url": "https://lifetunes-mall.jp/shop/g/gJ20260034/"
        }
      ],
      "sources": [
        {
          "url": "https://lifetunes-mall.jp/shop/g/gJ20260034/",
          "type": "official",
          "checked_at": "2026-10-01"
        }
      ],
      "tags": [
        "小说原作",
        "封面",
        "群像"
      ],
      "notes": null
    },
    {
      "id": "gagaga-J20260036",
      "name_ja": "『負けヒロインが多すぎる！』9巻 口絵タペストリー ～いざ祇園祭～",
      "name_zh": "小说第9卷彩页挂毯 前往祗园祭",
      "category": "tapestry",
      "campaign": "小说第9卷",
      "campaign_year": 2026,
      "manufacturer": "GAGAGA SHOP ONLINE",
      "variant": "祇园祭",
      "sale_format": {
        "type": "single",
        "total_variants": null
      },
      "spec": {
        "size": null,
        "material": null
      },
      "release_date": null,
      "list_price_yen": 3300,
      "official_status": "official",
      "verification": "confirmed_text",
      "images": [
        {
          "path": "images/items/gagaga-J20260036.jpg",
          "role": "product",
          "source_url": "https://lifetunes-mall.jp/img/3030/goods/S/J20260036-01.jpg",
          "thumbnail_path": "images/thumbs/gagaga-J20260036.webp"
        }
      ],
      "sales": [
        {
          "seller": "GAGAGA SHOP ONLINE",
          "phase": "general_sale",
          "url": "https://lifetunes-mall.jp/shop/g/gJ20260036/"
        }
      ],
      "sources": [
        {
          "url": "https://lifetunes-mall.jp/shop/g/gJ20260036/",
          "type": "official",
          "checked_at": "2026-10-01"
        }
      ],
      "tags": [
        "小说原作",
        "彩页",
        "祇园祭"
      ],
      "notes": null
    },
    {
      "id": "gagaga-J20260040",
      "name_ja": "『負けヒロインが多すぎる！』9巻 アクリルキーホルダーセット",
      "name_zh": "小说第9卷亚克力挂件套装",
      "category": "acrylic_keychain",
      "campaign": "小说第9卷",
      "campaign_year": 2026,
      "manufacturer": "GAGAGA SHOP ONLINE",
      "variant": "套装内含天爱星",
      "sale_format": {
        "type": "set",
        "total_variants": null
      },
      "spec": {
        "size": null,
        "material": "アクリル"
      },
      "release_date": null,
      "list_price_yen": 1650,
      "official_status": "official",
      "verification": "confirmed_text",
      "images": [
        {
          "path": "images/items/gagaga-J20260040.jpg",
          "role": "product",
          "source_url": "https://lifetunes-mall.jp/img/3030/goods/S/J20260040-01.jpg",
          "thumbnail_path": "images/thumbs/gagaga-J20260040.webp"
        }
      ],
      "sales": [
        {
          "seller": "GAGAGA SHOP ONLINE",
          "phase": "general_sale",
          "url": "https://lifetunes-mall.jp/shop/g/gJ20260040/"
        }
      ],
      "sources": [
        {
          "url": "https://lifetunes-mall.jp/shop/g/gJ20260040/",
          "type": "official",
          "checked_at": "2026-10-01"
        }
      ],
      "tags": [
        "小说原作",
        "套装"
      ],
      "notes": null
    },
    {
      "id": "gagaga-J20260042",
      "name_ja": "アクリルスタンド 志喜屋夢子＆馬剃天愛星",
      "name_zh": "志喜屋梦子＆马剃天爱星亚克力立牌",
      "category": "acrylic_stand",
      "campaign": "GAGAGA SHOP 2026",
      "campaign_year": 2026,
      "manufacturer": "GAGAGA SHOP ONLINE",
      "variant": "志喜屋梦子＆马剃天爱星",
      "sale_format": {
        "type": "single",
        "total_variants": null
      },
      "spec": {
        "size": null,
        "material": "アクリル"
      },
      "release_date": null,
      "list_price_yen": 2420,
      "official_status": "official",
      "verification": "confirmed_text",
      "images": [
        {
          "path": "images/items/gagaga-J20260042.jpg",
          "role": "product",
          "source_url": "https://lifetunes-mall.jp/img/3030/goods/S/J20260042-01.jpg",
          "thumbnail_path": "images/thumbs/gagaga-J20260042.webp"
        }
      ],
      "sales": [
        {
          "seller": "GAGAGA SHOP ONLINE",
          "phase": "general_sale",
          "url": "https://lifetunes-mall.jp/shop/g/gJ20260042/"
        }
      ],
      "sources": [
        {
          "url": "https://lifetunes-mall.jp/shop/g/gJ20260042/",
          "type": "official",
          "checked_at": "2026-10-01"
        }
      ],
      "tags": [
        "志喜屋梦子",
        "双人"
      ],
      "notes": null
    },
    {
      "id": "gagaga-J20260027",
      "name_ja": "『負けヒロインが多すぎる！』×『お散歩は季節をまとって。』 アクリルキーホルダー 馬剃天愛星",
      "name_zh": "《散步披上季节》联动亚克力挂件",
      "category": "acrylic_keychain",
      "campaign": "お散歩は季節をまとって。",
      "campaign_year": 2026,
      "manufacturer": "GAGAGA SHOP ONLINE",
      "variant": "马剃天爱星",
      "sale_format": {
        "type": "single",
        "total_variants": null
      },
      "spec": {
        "size": null,
        "material": "アクリル"
      },
      "release_date": null,
      "list_price_yen": 1430,
      "official_status": "official",
      "verification": "confirmed_text",
      "images": [
        {
          "path": "images/items/gagaga-J20260027.jpg",
          "role": "product",
          "source_url": "https://lifetunes-mall.jp/img/3030/goods/S/J20260027-01.jpg",
          "thumbnail_path": "images/thumbs/gagaga-J20260027.webp"
        }
      ],
      "sales": [
        {
          "seller": "GAGAGA SHOP ONLINE",
          "phase": "general_sale",
          "url": "https://lifetunes-mall.jp/shop/g/gJ20260027/"
        }
      ],
      "sources": [
        {
          "url": "https://lifetunes-mall.jp/shop/g/gJ20260027/",
          "type": "official",
          "checked_at": "2026-10-01"
        }
      ],
      "tags": [
        "跨作品联动",
        "单人"
      ],
      "notes": null
    },
    {
      "id": "gagaga-J2026001401",
      "name_ja": "『負けヒロインが多すぎる！』書影アクリルキーホルダー（1）",
      "name_zh": "小说封面亚克力挂件（1）",
      "category": "acrylic_keychain",
      "campaign": "书影系列",
      "campaign_year": 2026,
      "manufacturer": "GAGAGA SHOP ONLINE",
      "variant": "封面图（1）",
      "sale_format": {
        "type": "single",
        "total_variants": null
      },
      "spec": {
        "size": null,
        "material": "アクリル"
      },
      "release_date": null,
      "list_price_yen": 660,
      "official_status": "official",
      "verification": "confirmed_text",
      "images": [
        {
          "path": "images/items/gagaga-J2026001401.jpg",
          "role": "product",
          "source_url": "https://lifetunes-mall.jp/img/3030/goods/S/J20260001-01.jpg",
          "thumbnail_path": "images/thumbs/gagaga-J2026001401.webp"
        }
      ],
      "sales": [
        {
          "seller": "GAGAGA SHOP ONLINE",
          "phase": "general_sale",
          "url": "https://lifetunes-mall.jp/shop/g/gJ2026001401/"
        }
      ],
      "sources": [
        {
          "url": "https://lifetunes-mall.jp/shop/g/gJ2026001401/",
          "type": "official",
          "checked_at": "2026-10-01"
        }
      ],
      "tags": [
        "小说原作",
        "封面"
      ],
      "notes": null
    },
    {
      "id": "gagaga-J20250040",
      "name_ja": "竹島水族館コラボ ランダム缶バッジ",
      "name_zh": "竹岛水族馆联动随机徽章 马剃天爱星款",
      "category": "can_badge",
      "campaign": "竹岛水族馆",
      "campaign_year": 2025,
      "manufacturer": "GAGAGA SHOP ONLINE",
      "variant": "马剃天爱星",
      "sale_format": {
        "type": "random",
        "total_variants": 9
      },
      "spec": {
        "size": null,
        "material": null
      },
      "release_date": null,
      "list_price_yen": 500,
      "official_status": "official",
      "verification": "confirmed_text",
      "images": [
        {
          "path": "images/items/gagaga-J20250040.jpg",
          "role": "lineup",
          "source_url": "https://lifetunes-mall.jp/img/3030/goods/S/J20250040-01.jpg",
          "thumbnail_path": "images/thumbs/gagaga-J20250040.webp"
        }
      ],
      "sales": [
        {
          "seller": "竹岛水族馆",
          "phase": "event_sale",
          "url": "https://lifetunes-mall.jp/shop/g/gJ20250040/"
        },
        {
          "seller": "GAGAGA SHOP ONLINE",
          "phase": "after_sale",
          "url": "https://lifetunes-mall.jp/shop/g/gJ20250040/"
        }
      ],
      "sources": [
        {
          "url": "https://lifetunes-mall.jp/shop/g/gJ20250040/",
          "type": "official",
          "checked_at": "2026-10-01"
        }
      ],
      "tags": [
        "水族馆",
        "随机",
        "联动"
      ],
      "notes": null
    },
    {
      "id": "gagaga-J20250043",
      "name_ja": "竹島水族館コラボ アクリルキーホルダーセット C",
      "name_zh": "竹岛水族馆联动亚克力挂件套装 C",
      "category": "acrylic_keychain",
      "campaign": "竹岛水族馆",